{
  "$schema": "./schemas/cutout.agent-capabilities.schema.json",
  "version": "cutout.agent-capabilities.v1",
  "product": {
    "name": "Cutout",
    "positioning": "Agent-native Design OS with a visual workbench and repo-native control plane",
    "packageVersion": "0.1.25"
  },
  "protocol": {
    "control": "cutout.control.v1",
    "designIr": "design-ir.v1",
    "manifest": "cutout.manifest.v1",
    "policy": "cutout.policy.v1",
    "artifactIndex": "cutout.artifacts.v1"
  },
  "discovery": {
    "documentation": "docs/HEADLESS_AGENT_CONTROL.md",
    "schema": "schemas/cutout.agent-capabilities.schema.json",
    "validationCommand": "pnpm agent:validate",
    "skillsCatalog": "skills/index.json",
    "skillsSchema": "skills/schema.json",
    "skillsValidationCommand": "node scripts/validate-product-skills.mjs",
    "codexPlugin": "plugins/cutout/.codex-plugin/plugin.json"
  },
  "externalControllers": {
    "protocol": "cutout.external-controller.v1",
    "role": "External Coding Agents control Cutout through standard MCP, CLI, repository Skills and AGENTS.md. Cutout does not take over their coding runtime; the desktop app separately bundles a bounded Provider-backed Coding backend for its own reviewed design handoffs.",
    "clients": ["Codex", "Claude Code", "any MCP-capable coding agent"],
    "sessionBinding": "The MCP host fixes CUTOUT_PROJECT_ROOT; handshake returns opaque project/session bindings and never accepts a replacement root.",
    "progressiveDisclosure": ["cutout_controller_handshake", "cutout_capabilities_status", "cutout_skills_list", "cutout_skill_read"],
    "workflow": ["submit outcome and material/source references", "preview", "explicit approval when required", "apply", "observe or cancel", "read verified deliverables"],
    "sandboxOwnership": "The external Agent owns its coding sandbox. Cutout owns only its project state, managed exports and policy checks."
  },
  "desktopPlanningRuntime": {
    "runtimeId": "codex-system",
    "surface": "desktop-only",
    "status": "capability-required",
    "discovery": "signed-executable-and-generated-schema-probe",
    "authentication": "sanitized-native-status",
    "credentialCustody": "system-runtime-owned",
    "conversationBinding": false,
    "executionReason": "packaged-turn-execution-proof-required",
    "turnExecution": false,
    "headlessAvailable": false
  },
  "integrations": {
    "role": "Product, knowledge, design and prototype apps connected through their documented APIs or SDKs; integrations are not external controllers.",
    "available": ["figma-authorized-snapshot"],
    "hostRequired": ["figma-foreground-plugin", "obsidian-vault-plugin", "pen-mcp-cli", "paper-desktop-mcp", "framer-editor-plugin", "canva-apps-sdk"],
    "authorizationRequired": ["notion-p1-adapter", "github-p1-adapter", "canva-connect-api"],
    "planned": ["figma-node", "obsidian", "pen", "paper", "framer", "canva"],
    "liveSync": false
  },
  "operations": [
    { "type": "project.context", "modes": ["read"], "effect": "none", "approval": "none" },
    { "type": "material.list", "modes": ["read"], "effect": "none", "approval": "none" },
    { "type": "validate", "modes": ["read"], "effect": "none", "approval": "none" },
    { "type": "governance.preview", "modes": ["read"], "effect": "none", "approval": "none", "notes": "Runs the shared deterministic governance harness and returns coverage, measurements and blocking counts for evidence bound to the current Design IR revision." },
    { "type": "governance.validate", "modes": ["read"], "effect": "none", "approval": "none", "notes": "Returns structured governance findings without verbose evidence payloads; it performs no browser automation or mutation." },
    { "type": "governance.report", "modes": ["read"], "effect": "none", "approval": "none", "notes": "Returns the complete governance report with measured evidence and repair suggestions; supplied browser facts must already have been collected by an authorized harness." },
    { "type": "design.patch", "modes": ["dry-run"], "effect": "none", "approval": "none", "notes": "The v1 headless host previews patches but does not mutate Design IR with them." },
    { "type": "tokens.patch", "modes": ["dry-run"], "effect": "none", "approval": "none", "notes": "The v1 headless host previews token changes but does not apply them." },
    { "type": "source.ingest", "modes": ["dry-run", "apply"], "effect": "project-state", "approval": "policy-and-explicit-id" },
    { "type": "run.start", "modes": ["apply"], "effect": "project-state", "approval": "none", "notes": "Records intent and lifecycle events; it does not invoke a model." },
    { "type": "run.get", "modes": ["read"], "effect": "none", "approval": "none" },
    { "type": "run.cancel", "modes": ["apply"], "effect": "project-state", "approval": "none" },
    { "type": "run.events", "modes": ["read"], "effect": "none", "approval": "none" },
    { "type": "export.design-kit", "modes": ["dry-run", "apply"], "effect": "managed-export", "approval": "policy-and-explicit-id" },
    { "type": "export.brand-kit", "modes": ["dry-run", "apply"], "effect": "managed-export", "approval": "policy-and-explicit-id" },
    { "type": "export.starter", "modes": ["dry-run", "apply"], "effect": "managed-export", "approval": "policy-and-explicit-id" },
    { "type": "coding.execute", "modes": ["dry-run", "apply"], "effect": "provider-required", "approval": "policy-and-explicit-id", "notes": "The desktop app binds a verified Provider backend to a host-managed workspace and exact previewed patch. The bundled CLI/MCP headless host still requires injected adapters and otherwise returns capability-required." },
    { "type": "coding.review", "modes": ["dry-run", "apply"], "effect": "provider-required", "approval": "policy-and-explicit-id", "notes": "Review is a versioned CodingTask, never arbitrary shell or an unscoped repository read." },
    { "type": "coding.repair", "modes": ["dry-run", "apply"], "effect": "provider-required", "approval": "policy-and-explicit-id", "notes": "Repair consumes prior evidence and stays revision-, path-, command-, time-, and byte-budget scoped." },
    { "type": "tool.invoke", "modes": ["dry-run", "apply"], "effect": "provider-required", "approval": "none", "notes": "The desktop app executes enabled BYOK image Providers directly through the native secret/origin boundary and content-addressed artifact store; preview and run receipts expose progress, cancellation and evidence. No executor exists in the default CLI/MCP headless host, whose apply returns capability-required." }
  ],
  "cli": {
    "command": "pnpm cutout --project <root>",
    "commands": ["discover", "capabilities", "skills list", "skills read", "context", "materials", "validate", "governance preview", "governance validate", "governance report", "patch", "ingest", "run start", "run get", "run events", "run cancel", "export-kit", "export-brand-kit", "export-starter", "coding execute", "coding review", "coding repair", "registry list", "registry search", "registry get", "registry install", "registry receipt", "workflow list", "workflow get", "workflow compat"]
  },
  "mcp": {
    "transport": "stdio",
    "command": "pnpm cutout:mcp",
    "projectRootEnv": "CUTOUT_PROJECT_ROOT",
    "tools": ["cutout_controller_handshake", "cutout_capabilities_status", "cutout_skills_list", "cutout_skill_read", "cutout_outcome_submit", "cutout_deliverables_read", "cutout_run_start", "cutout_run_get", "cutout_run_events", "cutout_run_cancel", "cutout_project_context", "cutout_list_materials", "cutout_validate", "cutout_governance_preview", "cutout_governance_validate", "cutout_governance_report", "cutout_dry_run_patch", "cutout_plan_source_ingest", "cutout_apply_source_ingest", "cutout_plan_design_kit_export", "cutout_export_design_kit", "cutout_plan_brand_kit_export", "cutout_export_brand_kit", "cutout_plan_starter_export", "cutout_export_starter", "cutout_plan_coding_task", "cutout_apply_coding_task", "cutout_registry_list", "cutout_registry_search", "cutout_registry_get", "cutout_registry_plan_install", "cutout_registry_apply_install", "cutout_registry_install_receipt", "cutout_workflow_pack_list", "cutout_workflow_pack_get", "cutout_workflow_pack_compatibility"]
  },
  "policy": {
    "defaultMode": "dry-run",
    "applyRequires": ["operation enabled by .cutout policy", "durable mutations bind a host-issued short-lived single-use approval lease to the operation, preview digest, and expected revision"],
    "providerExecution": "An enabled desktop BYOK Provider is sufficient authority for Provider execution. Requests run immediately while previews, lifecycle events, cancellation, retained artifacts and signed receipts remain observable; the current headless host has no Provider executor.",
    "secrets": "Control requests, manifests and receipts reject or redact credential-shaped values; provider credentials stay in the native local credential store, auth headers are assembled in Rust, and credentials are never part of this manifest.",
    "filesystemBoundary": "Controlled paths resolve below the canonical selected project root and reject absolute paths, parent traversal and symlink components; generated writes stay below .cutout/exports and use no caller-selected destination.",
    "permissionBroker": "Host-issued cutout.capability-lease.v1 leases bind subject, request digest, approval id, scopes, paths, commands, hosts, budgets and expiry. Durable approval-lease state is HMAC-authenticated with a host key outside the workspace, and desktop writes require native confirmation rather than a caller-authored approval string; revocation, expiry, tampering and replay fail closed and authorization produces an immutable receipt.",